{
  "userId": 0,
  "authorName": "Read_Alphabet@egroups.com",
  "from": " &lt;Read_Alphabet@egroups.com&gt;",
  "replyTo": "LIST",
  "senderId": "Rzl2lzFa8X74iVhsXsQz9Ra-lkFGiJtF7mkaDgseIkvSRHpfCrQOYO1Ltw8kCvqXB4EbEaNi_sGPar6tq65WL8mcMw",
  "spamInfo": {
    "isSpam": false,
    "reason": "0"
  },
  "subject": "New file uploaded to Read_Alphabet",
  "postDate": "976578368",
  "msgId": 12,
  "canDelete": false,
  "contentTrasformed": false,
  "systemMessage": false,
  "headers": {
    "messageIdInHeader": "PDk3NjU3ODM2OC42NDc5NUBlZ3JvdXBzLmNvbT4="
  },
  "prevInTopic": 3,
  "nextInTopic": 20,
  "prevInTime": 11,
  "nextInTime": 13,
  "topicId": 3,
  "numMessagesInTopic": 91,
  "msgSnippet": "Hello, This email message is a notification to let you know that a file has been uploaded to the Files area of the Read_Alphabet group. File        :",
  "messageBody": "<div id=\"ygrps-yiv-56793995\">Hello,<br/>\n<br/>\nThis email message is a notification to let you know that<br/>\na file has been uploaded to the Files area of the Read_Alphabet <br/>\ngroup.<br/>\n<br/>\n  File        : /Fonts/Jerome.ttf <br/>\n  Uploaded by : <a rel=\"nofollow\" target=\"_blank\" href=\"mailto:frimmin@...\">frimmin@...</a> <br/>\n  Description : revised Jerome font <br/>\n<br/>\nYou can access this file at the URL<br/>\n<br/>\n<a rel=\"nofollow\" target=\"_blank\" href=\"http://www.egroups.com/files/Read_Alphabet/Fonts/Jerome%2Ettf\">http://www.egroups.com/files/Read_Alphabet/Fonts/Jerome%2Ettf</a> <br/>\n<br/>\nTo learn more about eGroups file sharing, please visit<br/>\n<br/>\n<a rel=\"nofollow\" target=\"_blank\" href=\"http://www.egroups.com/help/files.html\">http://www.egroups.com/help/files.html</a><br/>\n<br/>\n<br/>\nRegards,<br/>\n<br/>\n<a rel=\"nofollow\" target=\"_blank\" href=\"mailto:frimmin@...\">frimmin@...</a></div>",
  "specialLinks": [],
  "rawEmail": "Return-Path: &lt;notify@egroups.com&gt;\r\nReceived: (qmail 49309 invoked from network); 11 Dec 2000 23:46:10 -0000\r\nReceived: from unknown (10.1.10.27) by l10.egroups.com with QMQP; 11 Dec 2000 23:46:10 -0000\r\nReceived: from unknown (HELO fj.egroups.com) (10.1.10.46) by mta2 with SMTP; 11 Dec 2000 23:46:10 -0000\r\nX-eGroups-Return: notify@egroups.com\r\nReceived: from [10.1.1.35] by fj.egroups.com with NNFMP; 11 Dec 2000 23:46:09 -0000\r\nReceived: (qmail 64838 invoked by uid 65534); 11 Dec 2000 23:46:08 -0000\r\nDate: 11 Dec 2000 23:46:08 -0000\r\nMessage-ID: &lt;976578368.64795@egroups.com&gt;\r\nX-eGroups-Notify:  \r\nFrom:  &lt;Read_Alphabet@egroups.com&gt;\r\nTo: Read_Alphabet@egroups.com \r\nSubject: New file uploaded to Read_Alphabet \r\nMIME-Version: 1.0\r\nContent-Type: text/plain\r\nContent-Transfer-Encoding: 7bit\r\n\r\n\nHello,\n\nThis email message is a notification to let you know that\na file has been uploaded to the Files area of the Read_Alphabet \ngroup.\n\n  File        : /Fonts/Jerome.ttf \n  Uploaded by : frimmin@... \n  Description : revised Jerome font \n\nYou can access this file at the URL\n\nhttp://www.egroups.com/files/Read_Alphabet/Fonts/Jerome%2Ettf \n\nTo learn more about eGroups file sharing, please visit\n\nhttp://www.egroups.com/help/files.html\n\n\nRegards,\n\nfrimmin@...\n \n\n\n\n\n"
}