{
  "userId": 134841503,
  "authorName": "Ted Larson Freeman",
  "from": "&quot;Ted Larson Freeman&quot; &lt;freeman@...&gt;",
  "profile": "tedf255",
  "replyTo": "LIST",
  "senderId": "lyRFS4pTHVW6lIsHsE-XWaVlGnKnVm3v5VXC2sYrR5XS2lNYRvfdtXkLSRVTfG0aR4RY7tzxLtg4yXBPEsmGHVwcWhDnzn-AIpYePqVlklHTv0p-sH7yTQ",
  "spamInfo": {
    "isSpam": false,
    "reason": "12"
  },
  "subject": "QS-SAMPA: a proposed format for plain-text Quickscript",
  "postDate": "1196291529",
  "msgId": 1690,
  "canDelete": false,
  "contentTrasformed": false,
  "systemMessage": false,
  "headers": {
    "messageIdInHeader": "PDVkODcyOWYwMDcxMTI4MTUxMmo0NGE3NjM1Y3hiMjM1Mzk0NTAyMjM3MjAyQG1haWwuZ21haWwuY29tPg=="
  },
  "prevInTopic": 0,
  "nextInTopic": 1691,
  "prevInTime": 1689,
  "nextInTime": 1691,
  "topicId": 1690,
  "numMessagesInTopic": 46,
  "msgSnippet": "I would like to propose that we adopt a single-character plain text (ASCII) representation for the Read Alphabet, called QS-SAMPA. The name reflects its origin",
  "messageBody": "<div id=\"ygrps-yiv-432314413\">I would like to propose that we adopt a single-character plain text<br/>\n(ASCII) representation for the Read Alphabet, called QS-SAMPA. The<br/>\nname reflects its origin as an adaptation of the X-SAMPA phonetic<br/>\nalphabet (<a rel=\"nofollow\" target=\"_blank\" href=\"http://en.wikipedia.org/wiki/X-SAMPA)\">http://en.wikipedia.org/wiki/X-SAMPA)</a>. At the moment, we are<br/>\nusing heterogeneous notations, sometimes using names from the<br/>\nQuickscript Manual, sometimes using letter numbers, and sometimes<br/>\nusing the revised names proposed by Jon Zuck. This is inconvenient.<br/>\n<br/>\nAlso, the fonts that we currently have do not use identical<br/>\nkey-mappings. For example, &#39;W&#39; represents #20 in the junior font and<br/>\nthe ligature #26+36 in the jerome and Thoth fonts. (All three fonts<br/>\nmap the backquote character to #20.) The present font-mappings are not<br/>\nbased on a current linguistic standard, as far as I can tell, and do<br/>\nnot really treat letters #20 and #41-44 as full members in the<br/>\nalphabet. (For the numbering of #41-44, I have followed the example of<br/>\nthe document &quot;qs manual modern (beta).pdf&quot; under Files-&gt;Resources.)<br/>\nEven if one does not choose to use these letters oneself, there is no<br/>\ngood reason to deprecate them or give them strange key assignments.<br/>\n<br/>\nQS-SAMPA uses lower and upper case Latin letters for all QS letters,<br/>\nincluding the &quot;4 alternative letter-symbols&quot; and the two letters<br/>\nintroduced for use in &quot;Scottish, Welsh, and Irish place names.&quot; It<br/>\nalso includes a standard for the name-dot and angled brackets.<br/>\nAltogether, this list requires 46 letters and three punctuation marks.<br/>\n<br/>\nQS-SAMPA uses the backquote character for the name-dot because it<br/>\nvisually suggests the dot and is easy to type. Also, the backquote<br/>\nitself is rarely needed. Assigning angled-brackets to &#39;(&#39; and &#39;)&#39;<br/>\nseems like the obvious choice.<br/>\n<br/>\nQS-SAMPA would allow us to exchange written Quickscript as plain-text<br/>\nin email. If supported by a Quickscript font, we would only have to<br/>\ncopy and paste the text into a word processor and change the font in<br/>\norder to read it. I expect we would soon learn to read QS-SAMPA<br/>\ndirectly as well.<br/>\n<br/>\nAdding parentheses to a famous quote, we would write:<br/>\n    The rain (in Spain) falls mainly on the plain.<br/>\n<br/>\nIn QS-SAMPA this would be:<br/>\n    T ren (In `spen) fAlz menli An T plen.<br/>\n<br/>\n(Or at least, a West Coast American would write it that way.)<br/>\n<br/>\nThe basis for the QS-SAMPA proposal is the adaptation of X-SAMPA to QS<br/>\nrecently suggested by John Cowen:<br/>\n<a rel=\"nofollow\" target=\"_blank\" href=\"http://groups.yahoo.com/group/Read_Alphabet/message/1538\">http://groups.yahoo.com/group/Read_Alphabet/message/1538</a><br/>\n<br/>\nI&#39;ve added a spreadsheet and pdf file related to this proposal to the<br/>\ngroup website, under Files-&gt;QS-SAMPA. The spreadsheet, qs_sampa.pdf<br/>\n(which comes from qs_sampa.xls) contains columns with QS numbers, QM<br/>\nnames, revised names, the present keyboard assignments used in the<br/>\nThoth and jerome fonts, and QS-SAMPA. The file qs_sampa_array.pdf (and<br/>\nsource file qs_sampa_array.rtf) is arranged similarly to chart in the<br/>\nQuickscript Manual, using the Thoth and jerome fonts.<br/>\n<br/>\nFor those of you who are accustomed to typing with the present<br/>\nkeyboard assignments, I hope the benefit of having a simple standard<br/>\nwould make it worth the effort of having to retrain yourselves.<br/>\n<br/>\nLet me know what you think. Thanks.<br/>\n<br/>\nTed<br/>\n<br/>\nPS. Someone, perhaps Anthony, will no doubt point out that I&#39;ve<br/>\nincluded both Junior QS and alternative letters that are properly<br/>\nSenior QS letters. I would only say that we have room for them, so<br/>\nlet&#39;s go ahead and assign them. Likewise, if people want to add the<br/>\nso-called &quot;alternative letters&quot; for #8 and #22, we have room for them<br/>\nas well and I&#39;m open to any suggestions. Everything is on the table at<br/>\nthe moment, but it&#39;s high time we adopt a good standard.</div>",
  "specialLinks": [],
  "rawEmail": "Return-Path: &lt;tedf255@...&gt;\r\nX-Sender: tedf255@...\r\nX-Apparently-To: Read_Alphabet@yahoogroups.com\r\nX-Received: (qmail 77732 invoked from network); 28 Nov 2007 23:12:14 -0000\r\nX-Received: from unknown (66.218.67.96)\n  by m48.grp.scd.yahoo.com with QMQP; 28 Nov 2007 23:12:14 -0000\r\nX-Received: from unknown (HELO nf-out-0910.google.com) (64.233.182.184)\n  by mta17.grp.scd.yahoo.com with SMTP; 28 Nov 2007 23:12:13 -0000\r\nX-Received: by nf-out-0910.google.com with SMTP id 4so1321383nfv\n        for &lt;Read_Alphabet@yahoogroups.com&gt;; Wed, 28 Nov 2007 15:12:10 -0800 (PST)\r\nX-Received: by 10.78.122.16 with SMTP id u16mr6306326huc.1196291529892;\n        Wed, 28 Nov 2007 15:12:09 -0800 (PST)\r\nX-Received: by 10.78.48.11 with HTTP; Wed, 28 Nov 2007 15:12:09 -0800 (PST)\r\nMessage-ID: &lt;5d8729f00711281512j44a7635cxb235394502237202@...&gt;\r\nDate: Wed, 28 Nov 2007 15:12:09 -0800\r\nTo: Read_Alphabet@yahoogroups.com\r\nMIME-Version: 1.0\r\nContent-Type: text/plain; charset=ISO-8859-1\r\nContent-Transfer-Encoding: 7bit\r\nContent-Disposition: inline\r\nX-Google-Sender-Auth: 3ce3c56db524bcd1\r\nX-eGroups-Msg-Info: 1:12:0:0:0\r\nFrom: &quot;Ted Larson Freeman&quot; &lt;freeman@...&gt;\r\nSubject: QS-SAMPA: a proposed format for plain-text Quickscript\r\nX-Yahoo-Group-Post: member; u=134841503; y=sFHOPZcja6xplqnPpnCB3KMsTxHCK1Qy798B55kLYvldZQ\r\nX-Yahoo-Profile: tedf255\r\n\r\nI would like to propose that we adopt a single-character plain text\n(ASCII) representation for the Read Alphabet, called QS-SAMPA. The\nname reflects its origin as an adaptation of the X-SAMPA phonetic\nalphabet (http://en.wikipedia.org/wiki/X-SAMPA). At the moment, we are\nusing heterogeneous notations, sometimes using names from the\nQuickscript Manual, sometimes using letter numbers, and sometimes\nusing the revised names proposed by Jon Zuck. This is inconvenient.\n\nAlso, the fonts that we currently have do not use identical\nkey-mappings. For example, &#39;W&#39; represents #20 in the junior font and\nthe ligature #26+36 in the jerome and Thoth fonts. (All three fonts\nmap the backquote character to #20.) The present font-mappings are not\nbased on a current linguistic standard, as far as I can tell, and do\nnot really treat letters #20 and #41-44 as full members in the\nalphabet. (For the numbering of #41-44, I have followed the example of\nthe document &quot;qs manual modern (beta).pdf&quot; under Files-&gt;Resources.)\nEven if one does not choose to use these letters oneself, there is no\ngood reason to deprecate them or give them strange key assignments.\n\nQS-SAMPA uses lower and upper case Latin letters for all QS letters,\nincluding the &quot;4 alternative letter-symbols&quot; and the two letters\nintroduced for use in &quot;Scottish, Welsh, and Irish place names.&quot; It\nalso includes a standard for the name-dot and angled brackets.\nAltogether, this list requires 46 letters and three punctuation marks.\n\nQS-SAMPA uses the backquote character for the name-dot because it\nvisually suggests the dot and is easy to type. Also, the backquote\nitself is rarely needed. Assigning angled-brackets to &#39;(&#39; and &#39;)&#39;\nseems like the obvious choice.\n\nQS-SAMPA would allow us to exchange written Quickscript as plain-text\nin email. If supported by a Quickscript font, we would only have to\ncopy and paste the text into a word processor and change the font in\norder to read it. I expect we would soon learn to read QS-SAMPA\ndirectly as well.\n\nAdding parentheses to a famous quote, we would write:\n    The rain (in Spain) falls mainly on the plain.\n\nIn QS-SAMPA this would be:\n    T ren (In `spen) fAlz menli An T plen.\n\n(Or at least, a West Coast American would write it that way.)\n\nThe basis for the QS-SAMPA proposal is the adaptation of X-SAMPA to QS\nrecently suggested by John Cowen:\nhttp://groups.yahoo.com/group/Read_Alphabet/message/1538\n\nI&#39;ve added a spreadsheet and pdf file related to this proposal to the\ngroup website, under Files-&gt;QS-SAMPA. The spreadsheet, qs_sampa.pdf\n(which comes from qs_sampa.xls) contains columns with QS numbers, QM\nnames, revised names, the present keyboard assignments used in the\nThoth and jerome fonts, and QS-SAMPA. The file qs_sampa_array.pdf (and\nsource file qs_sampa_array.rtf) is arranged similarly to chart in the\nQuickscript Manual, using the Thoth and jerome fonts.\n\nFor those of you who are accustomed to typing with the present\nkeyboard assignments, I hope the benefit of having a simple standard\nwould make it worth the effort of having to retrain yourselves.\n\nLet me know what you think. Thanks.\n\nTed\n\nPS. Someone, perhaps Anthony, will no doubt point out that I&#39;ve\nincluded both Junior QS and alternative letters that are properly\nSenior QS letters. I would only say that we have room for them, so\nlet&#39;s go ahead and assign them. Likewise, if people want to add the\nso-called &quot;alternative letters&quot; for #8 and #22, we have room for them\nas well and I&#39;m open to any suggestions. Everything is on the table at\nthe moment, but it&#39;s high time we adopt a good standard.\n\n"
}