{
  "userId": 0,
  "authorName": "Read_Alphabet@egroups.com",
  "from": " &lt;Read_Alphabet@egroups.com&gt;",
  "replyTo": "LIST",
  "senderId": "ZqlukzKousnnwEeIxu2FylbZ4QgaNeyqBVVyr0rJ6WqcUW12zc9kV783Mf0CcRBbDo5DU2e4iHY8itrUqE9DLlilvg",
  "spamInfo": {
    "isSpam": false,
    "reason": "0"
  },
  "subject": "New file uploaded to Read_Alphabet",
  "postDate": "976860522",
  "msgId": 20,
  "canDelete": false,
  "contentTrasformed": false,
  "systemMessage": false,
  "headers": {
    "messageIdInHeader": "PDk3Njg2MDUyMi45NzM3MkBlZ3JvdXBzLmNvbT4="
  },
  "prevInTopic": 12,
  "nextInTopic": 41,
  "prevInTime": 19,
  "nextInTime": 21,
  "topicId": 3,
  "numMessagesInTopic": 91,
  "msgSnippet": "Hello, This email message is a notification to let you know that a file has been uploaded to the Files area of the Read_Alphabet group. File        :",
  "messageBody": "<div id=\"ygrps-yiv-881248998\">Hello,<br/>\n<br/>\nThis email message is a notification to let you know that<br/>\na file has been uploaded to the Files area of the Read_Alphabet <br/>\ngroup.<br/>\n<br/>\n  File        : /Texts/nothing.gold.doc <br/>\n  Uploaded by : <a rel=\"nofollow\" target=\"_blank\" href=\"mailto:pgabhart@...\">pgabhart@...</a> <br/>\n  Description : Nothing Gold Can Stay <br/>\n<br/>\nYou can access this file at the URL<br/>\n<br/>\n<a rel=\"nofollow\" target=\"_blank\" href=\"http://www.egroups.com/files/Read_Alphabet/Texts/nothing%2Egold%2Edoc\">http://www.egroups.com/files/Read_Alphabet/Texts/nothing%2Egold%2Edoc</a> <br/>\n<br/>\nTo learn more about eGroups file sharing, please visit<br/>\n<br/>\n<a rel=\"nofollow\" target=\"_blank\" href=\"http://www.egroups.com/help/files.html\">http://www.egroups.com/help/files.html</a><br/>\n<br/>\n<br/>\nRegards,<br/>\n<br/>\n<a rel=\"nofollow\" target=\"_blank\" href=\"mailto:pgabhart@...\">pgabhart@...</a></div>",
  "specialLinks": [],
  "rawEmail": "Return-Path: &lt;notify@egroups.com&gt;\r\nReceived: (qmail 21235 invoked from network); 15 Dec 2000 06:08:48 -0000\r\nReceived: from unknown (10.1.10.142) by m8.onelist.org with QMQP; 15 Dec 2000 06:08:48 -0000\r\nReceived: from unknown (HELO mv.egroups.com) (10.1.1.41) by mta3 with SMTP; 15 Dec 2000 07:09:53 -0000\r\nX-eGroups-Return: notify@egroups.com\r\nReceived: from [10.1.10.134] by mv.egroups.com with NNFMP; 15 Dec 2000 06:08:43 -0000\r\nReceived: (qmail 97377 invoked by uid 65534); 15 Dec 2000 06:08:42 -0000\r\nDate: 15 Dec 2000 06:08:42 -0000\r\nMessage-ID: &lt;976860522.97372@egroups.com&gt;\r\nX-eGroups-Notify:  \r\nFrom:  &lt;Read_Alphabet@egroups.com&gt;\r\nTo: Read_Alphabet@egroups.com \r\nSubject: New file uploaded to Read_Alphabet \r\nMIME-Version: 1.0\r\nContent-Type: text/plain\r\nContent-Transfer-Encoding: 7bit\r\n\r\n\nHello,\n\nThis email message is a notification to let you know that\na file has been uploaded to the Files area of the Read_Alphabet \ngroup.\n\n  File        : /Texts/nothing.gold.doc \n  Uploaded by : pgabhart@... \n  Description : Nothing Gold Can Stay \n\nYou can access this file at the URL\n\nhttp://www.egroups.com/files/Read_Alphabet/Texts/nothing%2Egold%2Edoc \n\nTo learn more about eGroups file sharing, please visit\n\nhttp://www.egroups.com/help/files.html\n\n\nRegards,\n\npgabhart@...\n \n\n\n\n\n"
}