{
  "userId": 0,
  "authorName": "Simon Barne",
  "from": "&quot;Simon Barne&quot; &lt;sosostris@...&gt;",
  "replyTo": "LIST",
  "senderId": "aIvfEK26RBrYynPYqFV-LHou4ZBTgRR9TzzQqwgWQ1mLzVaHXIk9M2lp0OIfNmO12sVEh6XvyFu68OkI0ms_pF-AcvrKS-ANjS3xJWg56bmh5Ew",
  "spamInfo": {
    "isSpam": false,
    "reason": "0"
  },
  "subject": "RE: Utter and Why",
  "postDate": "977892917",
  "msgId": 25,
  "canDelete": false,
  "contentTrasformed": false,
  "systemMessage": false,
  "headers": {
    "messageIdInHeader": "PExQQkJLSkZPR05GTkpLSUJES0dOS0VGT0NCQUEuc29zb3N0cmlzQGJkZy5jZW50cmluLm5ldC5pZD4="
  },
  "prevInTopic": 24,
  "nextInTopic": 26,
  "prevInTime": 24,
  "nextInTime": 26,
  "topicId": 23,
  "numMessagesInTopic": 6,
  "msgSnippet": "Thank you for the information about the alphabet. I have now found the Why character in the Jerome font. My website is at: http://www.geocities.com/simonbarne/",
  "messageBody": "<div id=\"ygrps-yiv-1517984514\">Thank you for the information about the alphabet. I have now found the Why<br/>\ncharacter in the Jerome font.<br/>\n<br/>\nMy website is at: <a rel=\"nofollow\" target=\"_blank\" href=\"http://www.geocities.com/simonbarne/\">http://www.geocities.com/simonbarne/</a><br/>\n<br/>\nI have not yet added a Quickscript page, but will let you know when I do.<br/>\nAny other information about the alphabet would be gratefully received.<br/>\n<br/>\nSimon Barne</div>",
  "specialLinks": [],
  "rawEmail": "Return-Path: &lt;sosostris@...&gt;\r\nX-Sender: sosostris@...\r\nX-Apparently-To: Read_Alphabet@egroups.com\r\nReceived: (EGP: mail-6_3_1_3); 27 Dec 2000 04:55:22 -0000\r\nReceived: (qmail 81526 invoked from network); 27 Dec 2000 04:55:22 -0000\r\nReceived: from unknown (10.1.10.142) by m8.onelist.org with QMQP; 27 Dec 2000 04:55:22 -0000\r\nReceived: from unknown (HELO bdg.centrin.net.id) (202.146.253.3) by mta3 with SMTP; 27 Dec 2000 05:56:25 -0000\r\nReceived: from telkomnetinstan (PMbdg-178.centrin.net.id [202.146.253.178]) by bdg.centrin.net.id (8.10.2/8.10.2) with SMTP id eBR4tCc08617 for &lt;Read_Alphabet@egroups.com&gt;; Wed, 27 Dec 2000 11:55:12 +0700\r\nReply-To: &lt;sosostris@...&gt;\r\nTo: &lt;Read_Alphabet@egroups.com&gt;\r\nSubject: RE: Utter and Why\r\nDate: Wed, 27 Dec 2000 11:55:17 +0700\r\nMessage-ID: &lt;LPBBKJFOGNFNJKIBDKGNKEFOCBAA.sosostris@...&gt;\r\nMIME-Version: 1.0\r\nContent-Type: text/plain; charset=&quot;Windows-1252&quot;\r\nContent-Transfer-Encoding: 7bit\r\nX-Priority: 3 (Normal)\r\nX-MSMail-Priority: Normal\r\nX-Mailer: Microsoft Outlook IMO, Build 9.0.2416 (9.0.2911.0)\r\nImportance: Normal\r\nX-MimeOLE: Produced By Microsoft MimeOLE V5.50.4133.2400\r\nFrom: &quot;Simon Barne&quot; &lt;sosostris@...&gt;\r\n\r\nThank you for the information about the alphabet. I have now found the Why\ncharacter in the Jerome font.\n\nMy website is at: http://www.geocities.com/simonbarne/\n\nI have not yet added a Quickscript page, but will let you know when I do.\nAny other information about the alphabet would be gratefully received.\n\nSimon Barne\n\n\n"
}