{
  "userId": 0,
  "authorName": "Read_Alphabet@egroups.com",
  "from": " &lt;Read_Alphabet@egroups.com&gt;",
  "replyTo": "LIST",
  "senderId": "__HawD3031Sf_h-ySCOFGEWigHbGC6ApaA2tdxgnOmE_oJRDKhpZ9xt441tXNkV7LngOKT1KqnuDn4kiJfHMG6ipnA",
  "spamInfo": {
    "isSpam": false,
    "reason": "0"
  },
  "subject": "New file uploaded to Read_Alphabet",
  "postDate": "975600443",
  "msgId": 3,
  "canDelete": false,
  "contentTrasformed": false,
  "systemMessage": false,
  "headers": {
    "messageIdInHeader": "PDk3NTYwMDQ0My44ODk4MEBlZ3JvdXBzLmNvbT4="
  },
  "prevInTopic": 0,
  "nextInTopic": 12,
  "prevInTime": 2,
  "nextInTime": 4,
  "topicId": 3,
  "numMessagesInTopic": 91,
  "msgSnippet": "Hello, This email message is a notification to let you know that a file has been uploaded to the Files area of the Read_Alphabet group. File        :",
  "messageBody": "<div id=\"ygrps-yiv-515207371\">Hello,<br/>\n<br/>\nThis email message is a notification to let you know that<br/>\na file has been uploaded to the Files area of the Read_Alphabet <br/>\ngroup.<br/>\n<br/>\n  File        : /Fonts/jerome.ttf <br/>\n  Uploaded by : <a rel=\"nofollow\" target=\"_blank\" href=\"mailto:frimmin@...\">frimmin@...</a> <br/>\n  Description : Read Font <br/>\n<br/>\nYou can access this file at the URL<br/>\n<br/>\n<a rel=\"nofollow\" target=\"_blank\" href=\"http://www.egroups.com/files/Read_Alphabet/Fonts/jerome%2Ettf\">http://www.egroups.com/files/Read_Alphabet/Fonts/jerome%2Ettf</a> <br/>\n<br/>\nTo learn more about eGroups file sharing, please visit<br/>\n<br/>\n<a rel=\"nofollow\" target=\"_blank\" href=\"http://www.egroups.com/help/files.html\">http://www.egroups.com/help/files.html</a><br/>\n<br/>\n<br/>\nRegards,<br/>\n<br/>\n<a rel=\"nofollow\" target=\"_blank\" href=\"mailto:frimmin@...\">frimmin@...</a></div>",
  "specialLinks": [],
  "rawEmail": "Return-Path: &lt;notify@egroups.com&gt;\r\nReceived: (qmail 54053 invoked from network); 30 Nov 2000 16:07:31 -0000\r\nReceived: from unknown (10.1.10.27) by l9.egroups.com with QMQP; 30 Nov 2000 16:07:31 -0000\r\nReceived: from unknown (HELO ej.egroups.com) (10.1.10.49) by mta2 with SMTP; 30 Nov 2000 16:07:31 -0000\r\nX-eGroups-Return: notify@egroups.com\r\nReceived: from [10.1.2.55] by ej.egroups.com with NNFMP; 30 Nov 2000 16:07:29 -0000\r\nReceived: (qmail 88993 invoked by uid 65534); 30 Nov 2000 16:07:23 -0000\r\nDate: 30 Nov 2000 16:07:23 -0000\r\nMessage-ID: &lt;975600443.88980@egroups.com&gt;\r\nX-eGroups-Notify:  \r\nFrom:  &lt;Read_Alphabet@egroups.com&gt;\r\nTo: Read_Alphabet@egroups.com \r\nSubject: New file uploaded to Read_Alphabet \r\nMIME-Version: 1.0\r\nContent-Type: text/plain\r\nContent-Transfer-Encoding: 7bit\r\n\r\n\nHello,\n\nThis email message is a notification to let you know that\na file has been uploaded to the Files area of the Read_Alphabet \ngroup.\n\n  File        : /Fonts/jerome.ttf \n  Uploaded by : frimmin@... \n  Description : Read Font \n\nYou can access this file at the URL\n\nhttp://www.egroups.com/files/Read_Alphabet/Fonts/jerome%2Ettf \n\nTo learn more about eGroups file sharing, please visit\n\nhttp://www.egroups.com/help/files.html\n\n\nRegards,\n\nfrimmin@...\n \n\n\n\n\n"
}