{
  "userId": 0,
  "authorName": "Read_Alphabet@yahoogroups.com",
  "from": " &lt;Read_Alphabet@yahoogroups.com&gt;",
  "replyTo": "LIST",
  "senderId": "iSw2HxTGY1e-3kY93Hcs9R9Adqk2tIntrSQIPUzfqRu7kdmDFE4J6BREANjWY9-IcjL1lCpyS2iC1dr6ugrj_6NiMpiuSrY",
  "spamInfo": {
    "isSpam": false,
    "reason": "0"
  },
  "subject": "New file uploaded to Read_Alphabet",
  "postDate": "988775620",
  "msgId": 41,
  "canDelete": false,
  "contentTrasformed": false,
  "systemMessage": false,
  "headers": {
    "messageIdInHeader": "PDk4ODc3NTYyMC4yOTA4MDkuNzIxMC5xaEB5YWhvb2dyb3Vwcy5jb20+"
  },
  "prevInTopic": 20,
  "nextInTopic": 44,
  "prevInTime": 40,
  "nextInTime": 42,
  "topicId": 3,
  "numMessagesInTopic": 91,
  "msgSnippet": "Hello, This email message is a notification to let you know that a file has been uploaded to the Files area of the Read_Alphabet group. File        :",
  "messageBody": "<div id=\"ygrps-yiv-489985991\">Hello,<br/>\n<br/>\nThis email message is a notification to let you know that<br/>\na file has been uploaded to the Files area of the Read_Alphabet <br/>\ngroup.<br/>\n<br/>\n  File        : /Resources/QuickScript(ImagesOfPages).pdf <br/>\n  Uploaded by : <a rel=\"nofollow\" target=\"_blank\" href=\"mailto:leehickenlooper@...\">leehickenlooper@...</a> <br/>\n  Description : 90%ScanOfQuikScriptManualPDF(2.5MB) <br/>\n<br/>\nYou can access this file at the URL<br/>\n<br/>\n<a rel=\"nofollow\" target=\"_blank\" href=\"http://groups.yahoo.com/group/Read_Alphabet/files/Resources/QuickScript%28ImagesOfPages%29.pdf\">http://groups.yahoo.com/group/Read_Alphabet/files/Resources/QuickScript%28ImagesOfPages%29.pdf</a> <br/>\n<br/>\nTo learn more about file sharing for your group, please visit<br/>\n<br/>\n<a rel=\"nofollow\" target=\"_blank\" href=\"http://help.yahoo.com/help/us/groups/files\">http://help.yahoo.com/help/us/groups/files</a><br/>\n<br/>\nRegards,<br/>\n<br/>\n<a rel=\"nofollow\" target=\"_blank\" href=\"mailto:leehickenlooper@...\">leehickenlooper@...</a></div>",
  "specialLinks": [],
  "rawEmail": "Return-Path: &lt;notify@yahoogroups.com&gt;\r\nReceived: (qmail 71494 invoked from network); 2 May 2001 06:53:21 -0000\r\nReceived: from unknown (10.1.10.26) by l8.egroups.com with QMQP; 2 May 2001 06:53:21 -0000\r\nReceived: from unknown (HELO c3.egroups.com) (10.1.10.50) by mta1 with SMTP; 2 May 2001 06:53:20 -0000\r\nX-eGroups-Return: notify@yahoogroups.com\r\nReceived: from [10.1.2.28] by c3.egroups.com with NNFMP; 02 May 2001 03:53:44 -0000\r\nDate: 2 May 2001 03:53:40 -0000\r\nMessage-ID: &lt;988775620.290809.7210.qh@yahoogroups.com&gt;\r\nX-eGroups-Notify:  \r\nFrom:  &lt;Read_Alphabet@yahoogroups.com&gt;\r\nTo: Read_Alphabet@yahoogroups.com \r\nSubject: New file uploaded to Read_Alphabet \r\nMIME-Version: 1.0\r\nContent-Type: text/plain\r\nContent-Transfer-Encoding: 7bit\r\n\r\n\nHello,\n\nThis email message is a notification to let you know that\na file has been uploaded to the Files area of the Read_Alphabet \ngroup.\n\n  File        : /Resources/QuickScript(ImagesOfPages).pdf \n  Uploaded by : leehickenlooper@... \n  Description : 90%ScanOfQuikScriptManualPDF(2.5MB) \n\nYou can access this file at the URL\n\nhttp://groups.yahoo.com/group/Read_Alphabet/files/Resources/QuickScript%28ImagesOfPages%29.pdf \n\nTo learn more about file sharing for your group, please visit\n\nhttp://help.yahoo.com/help/us/groups/files\n\nRegards,\n\nleehickenlooper@...\n \n\n\n\n\n\n"
}