{
  "userId": 0,
  "authorName": "Read_Alphabet@yahoogroups.com",
  "from": " &lt;Read_Alphabet@yahoogroups.com&gt;",
  "replyTo": "LIST",
  "senderId": "BgdgpDcCM7e66N2nvbVSKj0wUnvYYFqav9H8O43vTwUNl1Vqs4MUzCbTAI6GGI8LzSK1WvVAcVr6KJQ-UAApi8sN0drab-E",
  "spamInfo": {
    "isSpam": false,
    "reason": "0"
  },
  "subject": "New file uploaded to Read_Alphabet",
  "postDate": "991761132",
  "msgId": 44,
  "canDelete": false,
  "contentTrasformed": false,
  "systemMessage": false,
  "headers": {
    "messageIdInHeader": "PDk5MTc2MTEzMi44ODE5LjUxMzQzLmpkQHlhaG9vZ3JvdXBzLmNvbT4="
  },
  "prevInTopic": 41,
  "nextInTopic": 45,
  "prevInTime": 43,
  "nextInTime": 45,
  "topicId": 3,
  "numMessagesInTopic": 91,
  "msgSnippet": "Hello, This email message is a notification to let you know that a file has been uploaded to the Files area of the Read_Alphabet group. File        :",
  "messageBody": "<div id=\"ygrps-yiv-746175292\">Hello,<br/>\n<br/>\nThis email message is a notification to let you know that<br/>\na file has been uploaded to the Files area of the Read_Alphabet <br/>\ngroup.<br/>\n<br/>\n  File        : /Resources/SecondShawAlphabet(Image).pdf <br/>\n  Uploaded by : <a rel=\"nofollow\" target=\"_blank\" href=\"mailto:leehickenlooper@...\">leehickenlooper@...</a> <br/>\n  Description : Cole Turnleys sheet, Second Shaw Alphabet <br/>\n<br/>\nYou can access this file at the URL<br/>\n<br/>\n<a rel=\"nofollow\" target=\"_blank\" href=\"http://groups.yahoo.com/group/Read_Alphabet/files/Resources/SecondShawAlphabet%28Image%29.pdf\">http://groups.yahoo.com/group/Read_Alphabet/files/Resources/SecondShawAlphabet%28Image%29.pdf</a> <br/>\n<br/>\nTo learn more about file sharing for your group, please visit<br/>\n<br/>\n<a rel=\"nofollow\" target=\"_blank\" href=\"http://help.yahoo.com/help/us/groups/files\">http://help.yahoo.com/help/us/groups/files</a><br/>\n<br/>\nRegards,<br/>\n<br/>\n<a rel=\"nofollow\" target=\"_blank\" href=\"mailto:leehickenlooper@...\">leehickenlooper@...</a></div>",
  "specialLinks": [],
  "rawEmail": "Return-Path: &lt;notify@yahoogroups.com&gt;\r\nReceived: (qmail 85476 invoked from network); 5 Jun 2001 17:12:36 -0000\r\nReceived: from unknown (10.1.10.26) by m8.onelist.org with QMQP; 5 Jun 2001 17:12:36 -0000\r\nReceived: from unknown (HELO hn.egroups.com) (10.1.2.221) by mta1 with SMTP; 5 Jun 2001 17:12:22 -0000\r\nX-eGroups-Return: notify@yahoogroups.com\r\nReceived: from [10.1.10.69] by hn.egroups.com with NNFMP; 05 Jun 2001 17:12:15 -0000\r\nDate: 5 Jun 2001 17:12:12 -0000\r\nMessage-ID: &lt;991761132.8819.51343.jd@yahoogroups.com&gt;\r\nX-eGroups-Notify:  \r\nFrom:  &lt;Read_Alphabet@yahoogroups.com&gt;\r\nTo: Read_Alphabet@yahoogroups.com \r\nSubject: New file uploaded to Read_Alphabet \r\nMIME-Version: 1.0\r\nContent-Type: text/plain\r\nContent-Transfer-Encoding: 7bit\r\n\r\n\nHello,\n\nThis email message is a notification to let you know that\na file has been uploaded to the Files area of the Read_Alphabet \ngroup.\n\n  File        : /Resources/SecondShawAlphabet(Image).pdf \n  Uploaded by : leehickenlooper@... \n  Description : Cole Turnleys sheet, Second Shaw Alphabet \n\nYou can access this file at the URL\n\nhttp://groups.yahoo.com/group/Read_Alphabet/files/Resources/SecondShawAlphabet%28Image%29.pdf \n\nTo learn more about file sharing for your group, please visit\n\nhttp://help.yahoo.com/help/us/groups/files\n\nRegards,\n\nleehickenlooper@...\n \n\n\n\n\n\n"
}