{
  "userId": 0,
  "authorName": "Read_Alphabet@yahoogroups.com",
  "from": " &lt;Read_Alphabet@yahoogroups.com&gt;",
  "replyTo": "LIST",
  "senderId": "C7H-6EBx_r_eFZQPAJJNaurjOjcqGw1bBFg8PJI-7bhSA8UaMNjPvLIyudpQrnYBqNH5lX7Du6HGXKRmmXvJrTx5xMcG_mE",
  "spamInfo": {
    "isSpam": false,
    "reason": "0"
  },
  "subject": "New file uploaded to Read_Alphabet",
  "postDate": "991761386",
  "msgId": 45,
  "canDelete": false,
  "contentTrasformed": false,
  "systemMessage": false,
  "headers": {
    "messageIdInHeader": "PDk5MTc2MTM4Ni4xNjUzMTguNTEzNDIuamRAeWFob29ncm91cHMuY29tPg=="
  },
  "prevInTopic": 44,
  "nextInTopic": 68,
  "prevInTime": 44,
  "nextInTime": 46,
  "topicId": 3,
  "numMessagesInTopic": 91,
  "msgSnippet": "Hello, This email message is a notification to let you know that a file has been uploaded to the Files area of the Read_Alphabet group. File        :",
  "messageBody": "<div id=\"ygrps-yiv-538810890\">Hello,<br/>\n<br/>\nThis email message is a notification to let you know that<br/>\na file has been uploaded to the Files area of the Read_Alphabet <br/>\ngroup.<br/>\n<br/>\n  File        : /Resources/QuikScriptManual(Image).pdf <br/>\n  Uploaded by : <a rel=\"nofollow\" target=\"_blank\" href=\"mailto:leehickenlooper@...\">leehickenlooper@...</a> <br/>\n  Description : Includes Key & cleaned up scan <br/>\n<br/>\nYou can access this file at the URL<br/>\n<br/>\n<a rel=\"nofollow\" target=\"_blank\" href=\"http://groups.yahoo.com/group/Read_Alphabet/files/Resources/QuikScriptManual%28Image%29.pdf\">http://groups.yahoo.com/group/Read_Alphabet/files/Resources/QuikScriptManual%28Image%29.pdf</a> <br/>\n<br/>\nTo learn more about file sharing for your group, please visit<br/>\n<br/>\n<a rel=\"nofollow\" target=\"_blank\" href=\"http://help.yahoo.com/help/us/groups/files\">http://help.yahoo.com/help/us/groups/files</a><br/>\n<br/>\nRegards,<br/>\n<br/>\n<a rel=\"nofollow\" target=\"_blank\" href=\"mailto:leehickenlooper@...\">leehickenlooper@...</a></div>",
  "specialLinks": [],
  "rawEmail": "Return-Path: &lt;notify@yahoogroups.com&gt;\r\nReceived: (qmail 24902 invoked from network); 5 Jun 2001 17:16:27 -0000\r\nReceived: from unknown (10.1.10.26) by l9.egroups.com with QMQP; 5 Jun 2001 17:16:27 -0000\r\nReceived: from unknown (HELO hp.egroups.com) (10.1.2.220) by mta1 with SMTP; 5 Jun 2001 17:16:27 -0000\r\nX-eGroups-Return: notify@yahoogroups.com\r\nReceived: from [10.1.10.69] by hp.egroups.com with NNFMP; 05 Jun 2001 17:16:26 -0000\r\nDate: 5 Jun 2001 17:16:26 -0000\r\nMessage-ID: &lt;991761386.165318.51342.jd@yahoogroups.com&gt;\r\nX-eGroups-Notify:  \r\nFrom:  &lt;Read_Alphabet@yahoogroups.com&gt;\r\nTo: Read_Alphabet@yahoogroups.com \r\nSubject: New file uploaded to Read_Alphabet \r\nMIME-Version: 1.0\r\nContent-Type: text/plain\r\nContent-Transfer-Encoding: 7bit\r\n\r\n\nHello,\n\nThis email message is a notification to let you know that\na file has been uploaded to the Files area of the Read_Alphabet \ngroup.\n\n  File        : /Resources/QuikScriptManual(Image).pdf \n  Uploaded by : leehickenlooper@... \n  Description : Includes Key & cleaned up scan \n\nYou can access this file at the URL\n\nhttp://groups.yahoo.com/group/Read_Alphabet/files/Resources/QuikScriptManual%28Image%29.pdf \n\nTo learn more about file sharing for your group, please visit\n\nhttp://help.yahoo.com/help/us/groups/files\n\nRegards,\n\nleehickenlooper@...\n \n\n\n\n\n\n"
}