{
  "userId": 3379436,
  "authorName": "C. Paige Gabhart",
  "from": "&quot;C. Paige Gabhart&quot; &lt;pgabhart@...&gt;",
  "profile": "pgabhart",
  "replyTo": "LIST",
  "senderId": "rwHSdPSAzLxyfbjos_kWimRQZiRDAMkXUMaOqOkT6CTucstCgMN41QoVX49D9II-eZpw2T70olnBYYQnjNnk1YC0LqdTb3VdguHJ8tIIOEMV",
  "spamInfo": {
    "isSpam": false,
    "reason": "0"
  },
  "subject": "Macbeth",
  "postDate": "1013878351",
  "msgId": 60,
  "canDelete": false,
  "contentTrasformed": false,
  "systemMessage": false,
  "headers": {
    "messageIdInHeader": "PDNDNkU4RTRGLkQxNkNDQTAyQGNvcmVjb21tLm5ldD4="
  },
  "prevInTopic": 0,
  "nextInTopic": 61,
  "prevInTime": 59,
  "nextInTime": 61,
  "topicId": 60,
  "numMessagesInTopic": 30,
  "msgSnippet": "I have attached an example of Junior and Senior Quikscript to this post.  I had to use an attachment because I got sick of Windows crashing all the time and",
  "messageBody": "<div id=\"ygrps-yiv-1749429431\">I have attached an example of Junior and Senior Quikscript to this<br/>\npost.  I had to use an attachment because I got sick of Windows crashing<br/>\nall the time and switched to using Linux for my operating system.  I am<br/>\nrunning Windows 98 in a window under Linux.  I haven&#39;t figured out how<br/>\nto get Jerome into the Linux side of my computer yet.  (I&#39;m not even<br/>\nsure its possible since it is a truetype font.)<br/>\n<br/>\nPaige Gabhart</div>",
  "specialLinks": [],
  "attachmentsInfo": [],
  "rawEmail": "Return-Path: &lt;pgabhart@...&gt;\r\nX-Sender: pgabhart@...\r\nX-Apparently-To: Read_Alphabet@yahoogroups.com\r\nReceived: (EGP: mail-8_0_2); 16 Feb 2002 16:41:35 -0000\r\nReceived: (qmail 77580 invoked from network); 16 Feb 2002 16:41:30 -0000\r\nReceived: from unknown (216.115.97.171)\n  by m12.grp.snv.yahoo.com with QMQP; 16 Feb 2002 16:41:30 -0000\r\nReceived: from unknown (HELO mail5.mx.voyager.net) (216.93.66.204)\n  by mta3.grp.snv.yahoo.com with SMTP; 16 Feb 2002 16:41:30 -0000\r\nReceived: from corecomm.net (d185.as0.lsvl.ky.voyager.net [216.127.12.186])\n\tby mail5.mx.voyager.net (8.11.6/8.10.2) with ESMTP id g1GGgOf78992\n\tfor &lt;Read_Alphabet@yahoogroups.com&gt;; Sat, 16 Feb 2002 11:42:25 -0500 (EST)\r\nSender: pgabhart@...\r\nMessage-ID: &lt;3C6E8E4F.D16CCA02@...&gt;\r\nDate: Sat, 16 Feb 2002 11:52:31 -0500\r\nX-Mailer: Mozilla 4.75 [en] (X11; U; Linux 2.2.16-22 i586)\r\nX-Accept-Language: en\r\nMIME-Version: 1.0\r\nTo: Read_Alphabet@yahoogroups.com\r\nSubject: Macbeth\r\nContent-Type: multipart/mixed;\n boundary=&quot;------------A4607595F4B413FDD5FC8682&quot;\r\nFrom: &quot;C. Paige Gabhart&quot; &lt;pgabhart@...&gt;\r\nX-Yahoo-Group-Post: member; u=3379436\r\nX-Yahoo-Profile: pgabhart\r\n\r\n\r\n--------------A4607595F4B413FDD5FC8682\r\nContent-Type: text/plain; charset=us-ascii\r\nContent-Transfer-Encoding: 7bit\r\n\r\nI have attached an example of Junior and Senior Quikscript to this\npost.  I had to use an attachment because I got sick of Windows crashing\nall the time and switched to using Linux for my operating system.  I am\nrunning Windows 98 in a window under Linux.  I haven&#39;t figured out how\nto get Jerome into the Linux side of my computer yet.  (I&#39;m not even\nsure its possible since it is a truetype font.)\n\nPaige Gabhart\n\r\n--------------A4607595F4B413FDD5FC8682\r\nContent-Type: application/wordperfect5.1;\n name=&quot;macbeth.wpd&quot;\r\nContent-Disposition: inline;\n filename=&quot;macbeth.wpd&quot;\r\n\r\n[ Attachment content not displayed ]\r\n--------------A4607595F4B413FDD5FC8682--\r\n\n"
}