{
  "userId": 3379436,
  "authorName": "C. Paige Gabhart",
  "from": "&quot;C. Paige Gabhart&quot; &lt;pgabhart@...&gt;",
  "profile": "pgabhart",
  "replyTo": "LIST",
  "senderId": "Yv4ceXpGk6J4NDV7ZyfPktgcKg2sltRNhQWUren4yefGgt_oPPm7AY2foUCDTSHcgSK_aHxvs8r-mL6C7kykisCBMnT4x0zPUcry7KW8DUpT",
  "spamInfo": {
    "isSpam": false,
    "reason": "0"
  },
  "subject": "Macbeth",
  "postDate": "1014187596",
  "msgId": 65,
  "canDelete": false,
  "contentTrasformed": false,
  "systemMessage": false,
  "headers": {
    "messageIdInHeader": "PDNDNzM0NjRDLjIzREI5NTgwQGNvcmVjb21tLm5ldD4="
  },
  "prevInTopic": 64,
  "nextInTopic": 66,
  "prevInTime": 64,
  "nextInTime": 66,
  "topicId": 60,
  "numMessagesInTopic": 30,
  "msgSnippet": "Following are responses to 3 recent posts. Dear Robert: I m still dealing with my hybrid Linux system.  My response to your critique is attached to this post. ",
  "messageBody": "<div id=\"ygrps-yiv-1986368821\">Following are responses to 3 recent posts.<br/>\n<br/>\nDear Robert:<br/>\n<br/>\nI&#39;m still dealing with my hybrid Linux system.  My response to your<br/>\ncritique is attached to this post.<br/>\n<br/>\nPaige Gabhart<br/>\n<br/>\n<br/>\nDear Dennis:<br/>\n<br/>\nThanks for the tip on freetype.org.  I have looked briefly at the site,<br/>\nand it appears it should help me solve this problem.<br/>\n<br/>\n<br/>\nDear Ewout:<br/>\n<br/>\nI am going to need more help regarding your last post.  It was not clear<br/>\nto me exactly what this driver would do.  The list which seemed to set<br/>\ndh = Th ( I am working from memory here as I am picking up posts on 2<br/>\ndifferent computers).  I thought perhaps you were explaining that if you<br/>\ntype &quot;dh&quot; you would get Quikscript output for &quot;Thaw&quot; or &quot;They&quot;, and,<br/>\nthus, you would not have to learn the Quikscript keyboard map.  Please<br/>\nadvise.</div>",
  "specialLinks": [],
  "attachmentsInfo": [],
  "rawEmail": "Return-Path: &lt;pgabhart@...&gt;\r\nX-Sender: pgabhart@...\r\nX-Apparently-To: Read_Alphabet@yahoogroups.com\r\nReceived: (EGP: mail-8_0_2); 20 Feb 2002 06:37:07 -0000\r\nReceived: (qmail 93330 invoked from network); 20 Feb 2002 06:37:07 -0000\r\nReceived: from unknown (216.115.97.167)\n  by m5.grp.snv.yahoo.com with QMQP; 20 Feb 2002 06:37:07 -0000\r\nReceived: from unknown (HELO mail1.mx.voyager.net) (216.93.66.200)\n  by mta1.grp.snv.yahoo.com with SMTP; 20 Feb 2002 06:37:07 -0000\r\nReceived: from corecomm.net (d237.as0.lsvl.ky.voyager.net [216.127.12.238])\n\tby mail1.mx.voyager.net (8.11.6/8.10.2) with ESMTP id g1K6b3v58507\n\tfor &lt;Read_Alphabet@yahoogroups.com&gt;; Wed, 20 Feb 2002 01:37:03 -0500 (EST)\r\nSender: pgabhart@...\r\nMessage-ID: &lt;3C73464C.23DB9580@...&gt;\r\nDate: Wed, 20 Feb 2002 01:46:36 -0500\r\nX-Mailer: Mozilla 4.75 [en] (X11; U; Linux 2.2.16-22 i586)\r\nX-Accept-Language: en\r\nMIME-Version: 1.0\r\nTo: Read_Alphabet@yahoogroups.com\r\nSubject: Macbeth\r\nContent-Type: multipart/mixed;\n boundary=&quot;------------259F2413BC367FEB6AB65F4E&quot;\r\nFrom: &quot;C. Paige Gabhart&quot; &lt;pgabhart@...&gt;\r\nX-Yahoo-Group-Post: member; u=3379436\r\nX-Yahoo-Profile: pgabhart\r\n\r\n\r\n--------------259F2413BC367FEB6AB65F4E\r\nContent-Type: text/plain; charset=us-ascii\r\nContent-Transfer-Encoding: 7bit\r\n\r\nFollowing are responses to 3 recent posts.\n\nDear Robert:\n\nI&#39;m still dealing with my hybrid Linux system.  My response to your\ncritique is attached to this post.\n\nPaige Gabhart\n\n\nDear Dennis:\n\nThanks for the tip on freetype.org.  I have looked briefly at the site,\nand it appears it should help me solve this problem.\n\n\nDear Ewout:\n\nI am going to need more help regarding your last post.  It was not clear\nto me exactly what this driver would do.  The list which seemed to set\ndh = Th ( I am working from memory here as I am picking up posts on 2\ndifferent computers).  I thought perhaps you were explaining that if you\ntype &quot;dh&quot; you would get Quikscript output for &quot;Thaw&quot; or &quot;They&quot;, and,\nthus, you would not have to learn the Quikscript keyboard map.  Please\nadvise.\n\r\n--------------259F2413BC367FEB6AB65F4E\r\nContent-Type: application/wordperfect5.1;\n name=&quot;macbeth3.wpd&quot;\r\nContent-Disposition: inline;\n filename=&quot;macbeth3.wpd&quot;\r\n\r\n[ Attachment content not displayed ]\r\n--------------259F2413BC367FEB6AB65F4E--\r\n\n"
}