{
  "userId": 31034496,
  "authorName": "Ewout Stam",
  "from": "&quot;Ewout Stam&quot; &lt;teraiten@...&gt;",
  "profile": "teraiten",
  "replyTo": "LIST",
  "senderId": "mhhbO_Gh2HzybrznKCY0UF--r6XYd02V_ClKg93Z8MLWEPXKNFMtPf1q1at4MZE1zSV7Lm3kSOs_eU7zLqRZUo5G30wWQhLU",
  "spamInfo": {
    "isSpam": false,
    "reason": "0"
  },
  "subject": "Re: [Read_Alphabet] Macbeth",
  "postDate": "1014401667",
  "msgId": 70,
  "canDelete": false,
  "contentTrasformed": false,
  "systemMessage": false,
  "headers": {
    "messageIdInHeader": "PDAwNTYwMWMxYmJjYyRlZWZhN2I0MCQwNzA1NjQzZUBiZXJ0aGE+"
  },
  "prevInTopic": 67,
  "nextInTopic": 71,
  "prevInTime": 69,
  "nextInTime": 71,
  "topicId": 60,
  "numMessagesInTopic": 30,
  "msgSnippet": "... Van: C. Paige Gabhart  Aan: Read_Alphabet@yahoogroups.com  Datum: woensdag 20 februari 2002 7:37 ",
  "messageBody": "<div id=\"ygrps-yiv-514539153\">-----Oorspronkelijk bericht-----<br/>\nVan: C. Paige Gabhart &lt;<a rel=\"nofollow\" target=\"_blank\" href=\"mailto:pgabhart@...\">pgabhart@...</a>&gt;<br/>\nAan: <a rel=\"nofollow\" target=\"_blank\" href=\"mailto:Read_Alphabet@yahoogroups.com\">Read_Alphabet@yahoogroups.com</a> &lt;<a rel=\"nofollow\" target=\"_blank\" href=\"mailto:Read_Alphabet@yahoogroups.com\">Read_Alphabet@yahoogroups.com</a>&gt;<br/>\nDatum: woensdag 20 februari 2002 7:37<br/>\nOnderwerp: [Read_Alphabet] Macbeth<br/>\n<br/>\n<br/>\n<blockquote><span title=\"ireply\"> &gt;Following are responses to 3 recent posts.<br/>\n </span></blockquote>[snip]<br/>\n<br/>\n<blockquote><span title=\"ireply\"> &gt;Dear Ewout:<br/>\n&gt;<br/>\n&gt;I am going to need more help regarding your last post.  It was not clear<br/>\n&gt;to me exactly what this driver would do.  The list which seemed to set<br/>\n&gt;dh = Th ( I am working from memory here as I am picking up posts on 2<br/>\n&gt;different computers).  I thought perhaps you were explaining that if you<br/>\n&gt;type &quot;dh&quot; you would get Quikscript output for &quot;Thaw&quot; or &quot;They&quot;, and,<br/>\n&gt;thus, you would not have to learn the Quikscript keyboard map.  Please<br/>\n&gt;advise.<br/>\n<br/>\n </span></blockquote>If somebody would create a driver, it can be programmed to return the<br/>\n&#39;they&#39;-symbol when somebody types &#39;dh&#39;. Two letters become one, but it would<br/>\nindeed NOT require you to learn any keyboard map. You can just type a roman<br/>\nreform and get proper quikscript returned.<br/>\n<br/>\nBut someone will have to program this driver first. I certainly don&#39;t have<br/>\nthe time/knowledge (yet) to do so.<br/>\n<br/>\nEwout</div>",
  "specialLinks": [],
  "rawEmail": "Return-Path: &lt;teraiten@...&gt;\r\nX-Sender: teraiten@...\r\nX-Apparently-To: Read_Alphabet@yahoogroups.com\r\nReceived: (EGP: mail-8_0_2); 22 Feb 2002 18:15:55 -0000\r\nReceived: (qmail 52330 invoked from network); 22 Feb 2002 18:15:54 -0000\r\nReceived: from unknown (216.115.97.167)\n  by m11.grp.snv.yahoo.com with QMQP; 22 Feb 2002 18:15:54 -0000\r\nReceived: from unknown (HELO mint.nl.gxn.net) (62.100.30.37)\n  by mta1.grp.snv.yahoo.com with SMTP; 22 Feb 2002 18:15:54 -0000\r\nReceived: from bertha (asd-tel-ap01-d06-007.dial.freesurf.nl [62.100.5.7])\n\tby mint.nl.gxn.net (Postfix) with SMTP id EF7BC3BE2E\n\tfor &lt;Read_Alphabet@yahoogroups.com&gt;; Fri, 22 Feb 2002 19:15:39 +0100 (MET)\r\nMessage-ID: &lt;005601c1bbcc$eefa7b40$0705643e@bertha&gt;\r\nTo: &lt;Read_Alphabet@yahoogroups.com&gt;\r\nSubject: Re: [Read_Alphabet] Macbeth\r\nDate: Fri, 22 Feb 2002 19:14:27 +0100\r\nMIME-Version: 1.0\r\nContent-Type: text/plain;\n\tcharset=&quot;iso-8859-1&quot;\r\nContent-Transfer-Encoding: 7bit\r\nX-Priority: 3\r\nX-MSMail-Priority: Normal\r\nX-Mailer: Microsoft Outlook Express 4.72.3110.5\r\nX-MimeOLE: Produced By Microsoft MimeOLE V4.72.3110.3\r\nFrom: &quot;Ewout Stam&quot; &lt;teraiten@...&gt;\r\nX-Yahoo-Group-Post: member; u=31034496\r\nX-Yahoo-Profile: teraiten\r\n\r\n\n-----Oorspronkelijk bericht-----\nVan: C. Paige Gabhart &lt;pgabhart@...&gt;\nAan: Read_Alphabet@yahoogroups.com &lt;Read_Alphabet@yahoogroups.com&gt;\nDatum: woensdag 20 februari 2002 7:37\nOnderwerp: [Read_Alphabet] Macbeth\n\n\n&gt;Following are responses to 3 recent posts.\n[snip]\n\n&gt;Dear Ewout:\n&gt;\n&gt;I am going to need more help regarding your last post.  It was not clear\n&gt;to me exactly what this driver would do.  The list which seemed to set\n&gt;dh = Th ( I am working from memory here as I am picking up posts on 2\n&gt;different computers).  I thought perhaps you were explaining that if you\n&gt;type &quot;dh&quot; you would get Quikscript output for &quot;Thaw&quot; or &quot;They&quot;, and,\n&gt;thus, you would not have to learn the Quikscript keyboard map.  Please\n&gt;advise.\n\nIf somebody would create a driver, it can be programmed to return the\n&#39;they&#39;-symbol when somebody types &#39;dh&#39;. Two letters become one, but it would\nindeed NOT require you to learn any keyboard map. You can just type a roman\nreform and get proper quikscript returned.\n\nBut someone will have to program this driver first. I certainly don&#39;t have\nthe time/knowledge (yet) to do so.\n\nEwout\n\n\n"
}