{
  "userId": 3379436,
  "authorName": "C. Paige Gabhart",
  "from": "&quot;C. Paige Gabhart&quot; &lt;pgabhart@...&gt;",
  "profile": "pgabhart",
  "replyTo": "LIST",
  "senderId": "kenO8lKz5T0Js3QpewU3bPv5DTZWFk9JN9rYzbf22OiptqPmQQC6s7hC46fb30Q4gghL4zX5TC2_Go70MyWeY4ZPmJmFszEV55hcinO05Jqz",
  "spamInfo": {
    "isSpam": false,
    "reason": "0"
  },
  "subject": "RE: Macbeth",
  "postDate": "1014789948",
  "msgId": 84,
  "canDelete": false,
  "contentTrasformed": false,
  "systemMessage": false,
  "headers": {
    "messageIdInHeader": "PDNDN0M3NzNDLjVBMzBDQzAwQGNvcmVjb21tLm5ldD4="
  },
  "prevInTopic": 83,
  "nextInTopic": 85,
  "prevInTime": 83,
  "nextInTime": 85,
  "topicId": 60,
  "numMessagesInTopic": 30,
  "msgSnippet": "Rick: You commented on 2/25 that you had trouble reading the small curleys in  the Jerome font.  I believe this probably stems from two things:  1) your",
  "messageBody": "<div id=\"ygrps-yiv-1083100680\">Rick:<br/>\n<br/>\nYou commented on 2/25 that you had trouble reading the &quot;small &#39;curleys&#39;&quot;<br/>\nin  the Jerome font.  I believe this probably stems from two things:  1)<br/>\nyour relative inexperience in reading Quikscript;  2) font size.  I have<br/>\nnoticed the smaller fonts do make a few characters harder to read.   The<br/>\nuse of a 12 point font plus continued practice will no doubt clear this<br/>\nup for you.<br/>\n<br/>\nI believe your statement regarding Jerome looking like &quot;penmanship&quot; is<br/>\nalso a misunderstanding.  It is true that Read designed QS so that the<br/>\nletters naturally formed connections between many of the characters, and<br/>\nit is true that this speeds up handwriting.  But I disagree that this<br/>\nmakes Senior QS unsuitable for &quot;printing.&quot;  The fact that the roman<br/>\nalphabet is generally printed without letters touching one another does<br/>\nnot mean this is necessary for reading comprehension.   With more<br/>\nexperience in reading, I am confident you will find that the connections<br/>\ndo not hamper comprehension.  To my eyes, Senior QS is graceful,<br/>\nartistic and simpler in appearance than the roman alphabet.   The<br/>\nconnections seems very natural in use.<br/>\n<br/>\nThe beginner uses Junior QS because he is unfamiliar with the shapes of<br/>\nthe characters and still learning to form them when he writes.   As I<br/>\nwas learning QS some twenty-five years ago, I found that I rapidly<br/>\ngraduated to the Senior form and never looked back after that.  Junior<br/>\nQS seems very simplistic to me and lacks the interest generated by the<br/>\nunique word-shapes produced by the use of the half-letters and<br/>\nalternative letters.<br/>\n<br/>\nRegarding your question about programming a keyboard interface to look<br/>\nfor combinations of letters to avoid using the shift key so much:  we<br/>\nhave been discussing remapping the QS alphabet to make it more logical<br/>\nand easy to learn.  This would eliminate the over-dependence on the<br/>\n&quot;shift&quot; key.  Check the recent posts on the Read_Alphabet site about<br/>\nthis.<br/>\n<br/>\nIt would be useful to have a Junior QS font for beginners to aid them in<br/>\nlearning to read QS.  And if a person wants to keep using it rather than<br/>\ngoing on to Senior QS, that would be okay. No one is forced to use the<br/>\nhalf-letters or alternative letters if they don&#39;t want to.<br/>\n<br/>\nI would also suggest that you practice handwriting  QS as well as typing<br/>\nin it.  It is very handy for taking personal notes, and it does take<br/>\nsome effort to become proficient in it.<br/>\n<br/>\nYour comment regarding &quot;chord&quot; typing is interesting.  This sounds<br/>\nsomething like the machines that court reporters to take testimony down<br/>\nverbatim.  They hit more than one key simultaneously.  I don&#39;t know how<br/>\nfeasible this would be, but it might be worth looking into if anyone in<br/>\nthe group has any knowledge about how to do this sort of thing.<br/>\n<br/>\n<br/>\nPaige</div>",
  "specialLinks": [],
  "rawEmail": "Return-Path: &lt;pgabhart@...&gt;\r\nX-Sender: pgabhart@...\r\nX-Apparently-To: Read_Alphabet@yahoogroups.com\r\nReceived: (EGP: unknown); 27 Feb 2002 05:55:57 -0000\r\nReceived: (qmail 54689 invoked from network); 27 Feb 2002 05:55:56 -0000\r\nReceived: from unknown (216.115.97.167)\n  by m11.grp.snv.yahoo.com with QMQP; 27 Feb 2002 05:55:56 -0000\r\nReceived: from unknown (HELO mx5.mx.voyager.net) (216.93.66.84)\n  by mta1.grp.snv.yahoo.com with SMTP; 27 Feb 2002 05:55:56 -0000\r\nReceived: from mail3.mx.voyager.net (mail3.mx.voyager.net [216.93.66.202])\n\tby mx5.mx.voyager.net (8.11.6/8.10.2) with ESMTP id g1R5rqc40674\n\tfor &lt;Read_Alphabet@yahoogroups.com&gt;; Wed, 27 Feb 2002 00:53:52 -0500 (EST)\r\nReceived: from corecomm.net (d110.as0.lsvl.ky.voyager.net [216.127.12.111])\n\tby mail3.mx.voyager.net (8.11.6/8.10.2) with ESMTP id g1R5tse99771\n\tfor &lt;Read_Alphabet@yahoogroups.com&gt;; Wed, 27 Feb 2002 00:55:54 -0500 (EST)\r\nSender: pgabhart@...\r\nMessage-ID: &lt;3C7C773C.5A30CC00@...&gt;\r\nDate: Wed, 27 Feb 2002 01:05:48 -0500\r\nX-Mailer: Mozilla 4.75 [en] (X11; U; Linux 2.2.16-22 i586)\r\nX-Accept-Language: en\r\nMIME-Version: 1.0\r\nTo: Read_Alphabet@yahoogroups.com\r\nSubject: RE: Macbeth\r\nContent-Type: text/plain; charset=us-ascii\r\nContent-Transfer-Encoding: 7bit\r\nFrom: &quot;C. Paige Gabhart&quot; &lt;pgabhart@...&gt;\r\nX-Yahoo-Group-Post: member; u=3379436\r\nX-Yahoo-Profile: pgabhart\r\n\r\nRick:\n\nYou commented on 2/25 that you had trouble reading the &quot;small &#39;curleys&#39;&quot;\nin  the Jerome font.  I believe this probably stems from two things:  1)\nyour relative inexperience in reading Quikscript;  2) font size.  I have\nnoticed the smaller fonts do make a few characters harder to read.   The\nuse of a 12 point font plus continued practice will no doubt clear this\nup for you.\n\nI believe your statement regarding Jerome looking like &quot;penmanship&quot; is\nalso a misunderstanding.  It is true that Read designed QS so that the\nletters naturally formed connections between many of the characters, and\nit is true that this speeds up handwriting.  But I disagree that this\nmakes Senior QS unsuitable for &quot;printing.&quot;  The fact that the roman\nalphabet is generally printed without letters touching one another does\nnot mean this is necessary for reading comprehension.   With more\nexperience in reading, I am confident you will find that the connections\ndo not hamper comprehension.  To my eyes, Senior QS is graceful,\nartistic and simpler in appearance than the roman alphabet.   The\nconnections seems very natural in use.\n\nThe beginner uses Junior QS because he is unfamiliar with the shapes of\nthe characters and still learning to form them when he writes.   As I\nwas learning QS some twenty-five years ago, I found that I rapidly\ngraduated to the Senior form and never looked back after that.  Junior\nQS seems very simplistic to me and lacks the interest generated by the\nunique word-shapes produced by the use of the half-letters and\nalternative letters.\n\nRegarding your question about programming a keyboard interface to look\nfor combinations of letters to avoid using the shift key so much:  we\nhave been discussing remapping the QS alphabet to make it more logical\nand easy to learn.  This would eliminate the over-dependence on the\n&quot;shift&quot; key.  Check the recent posts on the Read_Alphabet site about\nthis.\n\nIt would be useful to have a Junior QS font for beginners to aid them in\nlearning to read QS.  And if a person wants to keep using it rather than\ngoing on to Senior QS, that would be okay. No one is forced to use the\nhalf-letters or alternative letters if they don&#39;t want to.\n\nI would also suggest that you practice handwriting  QS as well as typing\nin it.  It is very handy for taking personal notes, and it does take\nsome effort to become proficient in it.\n\nYour comment regarding &quot;chord&quot; typing is interesting.  This sounds\nsomething like the machines that court reporters to take testimony down\nverbatim.  They hit more than one key simultaneously.  I don&#39;t know how\nfeasible this would be, but it might be worth looking into if anyone in\nthe group has any knowledge about how to do this sort of thing.\n\n\nPaige\n\n\n"
}