{
  "userId": 89046929,
  "authorName": "geoflyfisher",
  "from": "&quot;geoflyfisher&quot; &lt;geoflyfisher@...&gt;",
  "profile": "geoflyfisher",
  "replyTo": "LIST",
  "senderId": "_1NIVfrN190ETvd6BBme3mu_4P1EkfPQMUWwAuX24P5zwq8PhvhhZIXGuscUIS7ZuNbY8swv9-oHFcX_McgPaOrmlLBNHiydpA8k-L2s",
  "spamInfo": {
    "isSpam": false,
    "reason": "0"
  },
  "subject": "Re: Keyboard Driver Experimental Version!",
  "postDate": "1015192052",
  "msgId": 92,
  "canDelete": false,
  "contentTrasformed": false,
  "systemMessage": false,
  "headers": {
    "messageIdInHeader": "PGE1dTVsaytvYjU4QGVHcm91cHMuY29tPg==",
    "inReplyToHeader": "PDAwNDUwMWMxYzJlNiRlNTJhMzYyMCRkNjEyNjQzZUBiZXJ0aGE+"
  },
  "prevInTopic": 91,
  "nextInTopic": 94,
  "prevInTime": 91,
  "nextInTime": 93,
  "topicId": 91,
  "numMessagesInTopic": 5,
  "msgSnippet": "OK... I downloaded the program, installed it...  worked around it for at least 5 minutes...  Very impatient I am! Could you please give us some step by step",
  "messageBody": "<div id=\"ygrps-yiv-190689733\">OK... I downloaded the program, installed it...  worked around it for <br/>\nat least 5 minutes...  Very impatient I am!<br/>\n<br/>\nCould you please give us some step by step directions?  I know I need <br/>\nthem.  I did try to read the .kmn file with a text processor but did <br/>\nnot see anything in the file.<br/>\n<br/>\nHelp.....<br/>\n<br/>\nRick<br/>\n<blockquote><span title=\"qreply\"> --- In Read_Alphabet@y..., &quot;Ewout Stam&quot; &lt;teraiten@y...&gt; wrote:<br/>\n&gt; Ok, cuz no-one has tried to create a driver yet, I have skipped my <br/>\nhomework and created this. It is far from perfect, and could use some <br/>\nfixes. You only need the normal Jerome font and <br/>\nwww.tavultesoft.com &#39;s Keyman, the Win 3.11 version, which does work <br/>\nunder win &#39;95+ . I dunno about other operating systems. <br/>\n<a rel=\"nofollow\" target=\"_blank\" href=\"http://www.tavultesoft.com/keyman/downloads/keyman32.exe\">http://www.tavultesoft.com/keyman/downloads/keyman32.exe</a> is the url <br/>\nof the program.<br/>\n&gt;  <br/>\n&gt; You will type in a roman reform scheme, based on Newromaji (it&#39;s <br/>\nnot really 100% real Newromaji, but anyway, it works)<br/>\n&gt;  <br/>\n&gt; Take a look into the .kmn file with a text editor to get an idea <br/>\nhow it works.<br/>\n&gt; <br/>\n&gt; His iz an egzympal tekst F tFpt wiH H kIbYrd-drFvD F hAve Jast mEd. <br/>\nit kAn stil Vz sam fiksiN, bat At lIst its redi fYr sam eksperimentiN.<br/>\n&gt; <br/>\n&gt; I have never typed so fast in QS. I&#39;m not even a fluent <br/>\nreader/writer in kwikskript, but this is really going to be <br/>\ninteresting.<br/>\n&gt;  <br/>\n&gt; This file can use some fixing, but you can also come up with a <br/>\ndifferent scheme of roman writing that gets converted into QS. <br/>\nPerhaps somebody can create a more efficient scheme. I have put c <br/>\nunder c, x under S, u under M and q under N because those sounds <br/>\noccur quite often and a digraph would not be needed, &#39;cuz there were <br/>\nstill some letters left.<br/>\n&gt;  <br/>\n&gt; AND perhaps we will one day have a driver that automatically <br/>\nconverts text to proper senior Quickscript without the user actually <br/>\npaying attention to it.<br/>\n&gt;  <br/>\n&gt; I have posted a similar message to the Shavian group.<br/>\n&gt;  <br/>\n&gt; /EvQt </span></blockquote></div>",
  "specialLinks": [],
  "rawEmail": "Return-Path: &lt;geoflyfisher@...&gt;\r\nX-Sender: geoflyfisher@...\r\nX-Apparently-To: Read_Alphabet@yahoogroups.com\r\nReceived: (EGP: unknown); 3 Mar 2002 21:47:36 -0000\r\nReceived: (qmail 48269 invoked from network); 3 Mar 2002 21:47:36 -0000\r\nReceived: from unknown (216.115.97.167)\n  by m3.grp.snv.yahoo.com with QMQP; 3 Mar 2002 21:47:36 -0000\r\nReceived: from unknown (HELO n9.groups.yahoo.com) (216.115.96.59)\n  by mta1.grp.snv.yahoo.com with SMTP; 3 Mar 2002 21:47:36 -0000\r\nReceived: from [216.115.97.81] by n9.groups.yahoo.com with NNFMP; 03 Mar 2002 21:47:36 -0000\r\nDate: Sun, 03 Mar 2002 21:47:32 -0000\r\nTo: Read_Alphabet@yahoogroups.com\r\nSubject: Re: Keyboard Driver Experimental Version!\r\nMessage-ID: &lt;a5u5lk+ob58@...&gt;\r\nIn-Reply-To: &lt;004501c1c2e6$e52a3620$d612643e@bertha&gt;\r\nUser-Agent: eGroups-EW/0.82\r\nMIME-Version: 1.0\r\nContent-Type: text/plain; charset=ISO-8859-1\r\nContent-Length: 1858\r\nX-Mailer: Yahoo Groups Message Poster\r\nFrom: &quot;geoflyfisher&quot; &lt;geoflyfisher@...&gt;\r\nX-Yahoo-Group-Post: member; u=89046929\r\nX-Yahoo-Profile: geoflyfisher\r\n\r\nOK... I downloaded the program, installed it...  worked around it for \nat least 5 minutes...  Very impatient I am!\n\nCould you please give us some step by step directions?  I know I need \nthem.  I did try to read the .kmn file with a text processor but did \nnot see anything in the file.\n\nHelp.....\n\nRick\n--- In Read_Alphabet@y..., &quot;Ewout Stam&quot; &lt;teraiten@y...&gt; wrote:\n&gt; Ok, cuz no-one has tried to create a driver yet, I have skipped my \nhomework and created this. It is far from perfect, and could use some \nfixes. You only need the normal Jerome font and \nwww.tavultesoft.com &#39;s Keyman, the Win 3.11 version, which does work \nunder win &#39;95+ . I dunno about other operating systems. \nhttp://www.tavultesoft.com/keyman/downloads/keyman32.exe is the url \nof the program.\n&gt;  \n&gt; You will type in a roman reform scheme, based on Newromaji (it&#39;s \nnot really 100% real Newromaji, but anyway, it works)\n&gt;  \n&gt; Take a look into the .kmn file with a text editor to get an idea \nhow it works.\n&gt; \n&gt; His iz an egzympal tekst F tFpt wiH H kIbYrd-drFvD F hAve Jast mEd. \nit kAn stil Vz sam fiksiN, bat At lIst its redi fYr sam eksperimentiN.\n&gt; \n&gt; I have never typed so fast in QS. I&#39;m not even a fluent \nreader/writer in kwikskript, but this is really going to be \ninteresting.\n&gt;  \n&gt; This file can use some fixing, but you can also come up with a \ndifferent scheme of roman writing that gets converted into QS. \nPerhaps somebody can create a more efficient scheme. I have put c \nunder c, x under S, u under M and q under N because those sounds \noccur quite often and a digraph would not be needed, &#39;cuz there were \nstill some letters left.\n&gt;  \n&gt; AND perhaps we will one day have a driver that automatically \nconverts text to proper senior Quickscript without the user actually \npaying attention to it.\n&gt;  \n&gt; I have posted a similar message to the Shavian group.\n&gt;  \n&gt; /EvQt\n\n\n"
}